{
  "$schema": "https://json-schema.org/draft/2020-12/schema",
  "$id": "https://tale-ui.dev/schemas/candidate-disposition.schema.json",
  "title": "Evidence-backed candidate dispositions",
  "type": "object",
  "additionalProperties": false,
  "required": ["schemaVersion", "inventory", "evidenceRevision", "records"],
  "$defs": {
    "record": {
      "type": "object",
      "additionalProperties": false,
      "required": ["candidate", "disposition", "rationale", "evidence", "evidenceDigest"],
      "properties": {
        "candidate": { "type": "string" },
        "disposition": { "enum": ["approve", "defer", "reject"] },
        "a2uiDisposition": { "const": "n/a" },
        "rationale": { "type": "string", "minLength": 1 },
        "evidence": { "$ref": "#/$defs/evidence" },
        "evidenceDigest": { "type": "string", "pattern": "^sha256:[a-f0-9]{64}$" }
      }
    },
    "evidence": {
      "type": "object",
      "additionalProperties": false,
      "required": ["sources", "accessibility", "state", "ssr", "ownership"],
      "properties": {
        "sources": {
          "type": "array",
          "minItems": 1,
          "uniqueItems": true,
          "items": { "type": "string", "minLength": 1 }
        },
        "repeatedTemplateEvidence": { "type": "string", "minLength": 1 },
        "ordinaryDataApi": { "type": "string", "minLength": 1 },
        "accessibility": { "type": "string", "minLength": 1 },
        "state": { "type": "string", "minLength": 1 },
        "streaming": { "type": "string", "minLength": 1 },
        "localization": { "type": "string", "minLength": 1 },
        "security": { "type": "string", "minLength": 1 },
        "ssr": { "type": "string", "minLength": 1 },
        "performance": { "type": "string", "minLength": 1 },
        "ownership": { "type": "string", "minLength": 1 },
        "migration": { "type": "string", "minLength": 1 }
      }
    },
    "tableRecords": {
      "type": "array",
      "minItems": 10,
      "maxItems": 10,
      "items": {
        "allOf": [
          { "$ref": "#/$defs/record" },
          {
            "properties": {
              "candidate": {
                "enum": [
                  "selection",
                  "sorting",
                  "pagination",
                  "filtering",
                  "column visibility/settings",
                  "column resize",
                  "sticky columns",
                  "row expansion",
                  "grouped/tree rows",
                  "virtualization"
                ]
              }
            }
          }
        ]
      },
      "allOf": [
        { "contains": { "properties": { "candidate": { "const": "selection" } } } },
        { "contains": { "properties": { "candidate": { "const": "sorting" } } } },
        { "contains": { "properties": { "candidate": { "const": "pagination" } } } },
        { "contains": { "properties": { "candidate": { "const": "filtering" } } } },
        {
          "contains": {
            "properties": { "candidate": { "const": "column visibility/settings" } }
          }
        },
        { "contains": { "properties": { "candidate": { "const": "column resize" } } } },
        { "contains": { "properties": { "candidate": { "const": "sticky columns" } } } },
        { "contains": { "properties": { "candidate": { "const": "row expansion" } } } },
        { "contains": { "properties": { "candidate": { "const": "grouped/tree rows" } } } },
        { "contains": { "properties": { "candidate": { "const": "virtualization" } } } }
      ]
    },
    "appShellRecords": {
      "type": "array",
      "minItems": 8,
      "maxItems": 8,
      "items": {
        "allOf": [
          { "$ref": "#/$defs/record" },
          {
            "properties": {
              "candidate": {
                "enum": [
                  "root",
                  "header",
                  "sidebar",
                  "main",
                  "secondary panel",
                  "mobile navigation",
                  "skip link",
                  "resizable-region adapter"
                ]
              },
              "evidence": {
                "required": [
                  "sources",
                  "repeatedTemplateEvidence",
                  "accessibility",
                  "state",
                  "ssr",
                  "ownership"
                ]
              }
            }
          }
        ]
      },
      "allOf": [
        { "contains": { "properties": { "candidate": { "const": "root" } } } },
        { "contains": { "properties": { "candidate": { "const": "header" } } } },
        { "contains": { "properties": { "candidate": { "const": "sidebar" } } } },
        { "contains": { "properties": { "candidate": { "const": "main" } } } },
        { "contains": { "properties": { "candidate": { "const": "secondary panel" } } } },
        { "contains": { "properties": { "candidate": { "const": "mobile navigation" } } } },
        { "contains": { "properties": { "candidate": { "const": "skip link" } } } },
        {
          "contains": {
            "properties": { "candidate": { "const": "resizable-region adapter" } }
          }
        }
      ]
    },
    "chatRecords": {
      "type": "array",
      "minItems": 9,
      "maxItems": 9,
      "items": {
        "allOf": [
          { "$ref": "#/$defs/record" },
          {
            "properties": {
              "candidate": {
                "enum": [
                  "ChatLayout",
                  "MessageList",
                  "Message",
                  "MessageBubble",
                  "MessageMetadata",
                  "SystemMessage",
                  "Composer",
                  "ToolCall",
                  "streaming-text utility"
                ]
              },
              "evidence": {
                "required": [
                  "sources",
                  "ordinaryDataApi",
                  "accessibility",
                  "state",
                  "streaming",
                  "localization",
                  "security",
                  "ssr",
                  "performance",
                  "ownership",
                  "migration"
                ]
              }
            }
          }
        ]
      },
      "allOf": [
        { "contains": { "properties": { "candidate": { "const": "ChatLayout" } } } },
        { "contains": { "properties": { "candidate": { "const": "MessageList" } } } },
        { "contains": { "properties": { "candidate": { "const": "Message" } } } },
        { "contains": { "properties": { "candidate": { "const": "MessageBubble" } } } },
        { "contains": { "properties": { "candidate": { "const": "MessageMetadata" } } } },
        { "contains": { "properties": { "candidate": { "const": "SystemMessage" } } } },
        { "contains": { "properties": { "candidate": { "const": "Composer" } } } },
        { "contains": { "properties": { "candidate": { "const": "ToolCall" } } } },
        {
          "contains": {
            "properties": { "candidate": { "const": "streaming-text utility" } }
          }
        }
      ]
    },
    "contentRecords": {
      "type": "array",
      "minItems": 6,
      "maxItems": 6,
      "items": {
        "allOf": [
          { "$ref": "#/$defs/record" },
          {
            "properties": {
              "candidate": {
                "enum": ["Kbd", "Timestamp", "Blockquote", "Citation", "CodeBlock", "MetadataList"]
              },
              "evidence": {
                "required": [
                  "sources",
                  "accessibility",
                  "state",
                  "security",
                  "ssr",
                  "performance",
                  "ownership",
                  "migration"
                ]
              }
            }
          }
        ]
      },
      "allOf": [
        { "contains": { "properties": { "candidate": { "const": "Kbd" } } } },
        { "contains": { "properties": { "candidate": { "const": "Timestamp" } } } },
        { "contains": { "properties": { "candidate": { "const": "Blockquote" } } } },
        { "contains": { "properties": { "candidate": { "const": "Citation" } } } },
        { "contains": { "properties": { "candidate": { "const": "CodeBlock" } } } },
        { "contains": { "properties": { "candidate": { "const": "MetadataList" } } } }
      ]
    },
    "componentEquivalenceExpansionRecord": {
      "allOf": [
        { "$ref": "#/$defs/record" },
        {
          "required": ["a2uiDisposition"],
          "properties": {
            "disposition": { "const": "approve" },
            "a2uiDisposition": { "const": "n/a" },
            "evidence": {
              "required": [
                "sources",
                "accessibility",
                "state",
                "localization",
                "security",
                "ssr",
                "performance",
                "ownership",
                "migration"
              ]
            }
          }
        }
      ]
    },
    "componentEquivalenceExpansionRecords": {
      "type": "array",
      "prefixItems": [
        {
          "allOf": [
            { "$ref": "#/$defs/componentEquivalenceExpansionRecord" },
            { "properties": { "candidate": { "const": "AspectRatio" } } }
          ]
        },
        {
          "allOf": [
            { "$ref": "#/$defs/componentEquivalenceExpansionRecord" },
            { "properties": { "candidate": { "const": "Blockquote" } } }
          ]
        },
        {
          "allOf": [
            { "$ref": "#/$defs/componentEquivalenceExpansionRecord" },
            { "properties": { "candidate": { "const": "ButtonGroup" } } }
          ]
        },
        {
          "allOf": [
            { "$ref": "#/$defs/componentEquivalenceExpansionRecord" },
            { "properties": { "candidate": { "const": "Citation" } } }
          ]
        },
        {
          "allOf": [
            { "$ref": "#/$defs/componentEquivalenceExpansionRecord" },
            { "properties": { "candidate": { "const": "Code" } } }
          ]
        },
        {
          "allOf": [
            { "$ref": "#/$defs/componentEquivalenceExpansionRecord" },
            { "properties": { "candidate": { "const": "Lightbox" } } }
          ]
        },
        {
          "allOf": [
            { "$ref": "#/$defs/componentEquivalenceExpansionRecord" },
            { "properties": { "candidate": { "const": "Markdown" } } }
          ]
        },
        {
          "allOf": [
            { "$ref": "#/$defs/componentEquivalenceExpansionRecord" },
            { "properties": { "candidate": { "const": "Outline" } } }
          ]
        },
        {
          "allOf": [
            { "$ref": "#/$defs/componentEquivalenceExpansionRecord" },
            { "properties": { "candidate": { "const": "OverflowList" } } }
          ]
        },
        {
          "allOf": [
            { "$ref": "#/$defs/componentEquivalenceExpansionRecord" },
            { "properties": { "candidate": { "const": "Resizable" } } }
          ]
        },
        {
          "allOf": [
            { "$ref": "#/$defs/componentEquivalenceExpansionRecord" },
            { "properties": { "candidate": { "const": "Skeleton" } } }
          ]
        },
        {
          "allOf": [
            { "$ref": "#/$defs/componentEquivalenceExpansionRecord" },
            { "properties": { "candidate": { "const": "Timestamp" } } }
          ]
        },
        {
          "allOf": [
            { "$ref": "#/$defs/componentEquivalenceExpansionRecord" },
            { "properties": { "candidate": { "const": "Toast" } } }
          ]
        }
      ],
      "items": false,
      "minItems": 13,
      "maxItems": 13,
      "uniqueItems": true
    }
  },
  "properties": {
    "schemaVersion": { "const": "1.0.0" },
    "inventory": {
      "enum": ["table", "app-shell", "chat", "content", "component-equivalence-expansion"]
    },
    "source": { "type": "string", "minLength": 1 },
    "evidenceRevision": { "type": "string" },
    "records": { "type": "array" }
  },
  "oneOf": [
    {
      "properties": {
        "inventory": { "const": "table" },
        "records": { "$ref": "#/$defs/tableRecords" }
      }
    },
    {
      "properties": {
        "inventory": { "const": "app-shell" },
        "records": { "$ref": "#/$defs/appShellRecords" }
      }
    },
    {
      "properties": {
        "inventory": { "const": "chat" },
        "records": { "$ref": "#/$defs/chatRecords" }
      }
    },
    {
      "properties": {
        "inventory": { "const": "content" },
        "records": { "$ref": "#/$defs/contentRecords" }
      }
    },
    {
      "required": ["source"],
      "properties": {
        "inventory": { "const": "component-equivalence-expansion" },
        "source": {
          "const": "docs/plans/component-equivalence-expansion-implementation-plan.md"
        },
        "records": { "$ref": "#/$defs/componentEquivalenceExpansionRecords" }
      }
    }
  ]
}
